{
  "name": "irrigation-node",
  "description": "Opens an irrigation valve when soil moisture falls below 30 % and closes it again above 40 %, and alerts when the soil dries below 10 % or is waterlogged above 60 %. Samples slowly, since soil changes over hours and the battery has to last.",
  "topic": "farm/irrigation/soil-moisture",
  "control": {
    "kind": "setpoint",
    "setpoint": 35.0,
    "hysteresis": 5.0,
    "cooling": false,
    "safe_band": 25.0
  },
  "power": {
    "active_secs": 300,
    "saver_secs": 1800,
    "critical_secs": 3600,
    "saver_below": 0.5,
    "critical_below": 0.2,
    "hysteresis": 0.05
  },
  "presentation": {
    "elements": [
      {
        "key": "soil_moisture",
        "unit": "percent",
        "label": "Soil moisture",
        "labels": {
          "fr": "Humidité du sol",
          "sw": "Unyevu wa udongo"
        },
        "viz": "droplet",
        "band": [
          10.0,
          60.0
        ],
        "stat": false,
        "scope": "always",
        "span": false
      },
      {
        "key": "drip_valve",
        "unit": "state",
        "label": "Drip valve",
        "labels": {
          "fr": "Vanne goutte-à-goutte",
          "sw": "Vali ya matone"
        },
        "viz": "valve",
        "stat": false,
        "scope": "always",
        "span": false,
        "state": "state.closed"
      }
    ]
  }
}
