{
  "name": "well-level",
  "description": "Reports a well's water level and warns once the level is on course to reach the dry mark within six more samples, so a pump is stopped before it runs dry.",
  "topic": "water/well/level",
  "control": {
    "kind": "level",
    "empty": 0.5,
    "warn_within": 6
  },
  "power": {
    "active_secs": 600,
    "saver_secs": 1800,
    "critical_secs": 3600,
    "saver_below": 0.5,
    "critical_below": 0.2,
    "hysteresis": 0.05
  },
  "presentation": {
    "elements": [
      {
        "key": "well_level",
        "unit": "meter",
        "label": "Well level",
        "labels": {
          "fr": "Niveau du puits",
          "sw": "Kina cha kisima"
        },
        "viz": "bar",
        "band": [
          1.0,
          6.0
        ],
        "stat": false,
        "scope": "always",
        "span": false
      },
      {
        "key": "battery_voltage",
        "unit": "volt",
        "label": "Battery",
        "labels": {
          "fr": "Batterie",
          "sw": "Betri"
        },
        "viz": "battery",
        "band": [
          3.5,
          4.3
        ],
        "stat": true,
        "scope": "always",
        "span": false
      }
    ]
  }
}
